{
  "profile": "reviewed-measurement-selector-1.0",
  "mapping_context_id": "9c57d890ca11b1ebb7053091c715ab4350aae862e834bfa64b6e85f68ca3079d",
  "class_iri": "https://example.org/trajectory/measurement-record-query/pressure-family",
  "source_item_ids": [
    "pressure_a",
    "pressure_b",
    "pressure_c"
  ],
  "unit_lexical": "mmHg"
}
